{
  "schema_version": 1,
  "name": "domain separation user",
  "canonicalization": "text_v1",
  "input": {
    "encoding": "utf8",
    "value": "same value"
  },
  "canonical_bytes_hex": "73616d652076616c7565",
  "domain": "user:v1",
  "hash_algo": "hmac_sha256_64",
  "secret": {
    "utf8": "domain-vector-secret"
  },
  "expected": {
    "digest64_hex": "3148161270aecd34",
    "digest64_uint": 3551112574637362484
  }
}
