{
  "schema_version": 1,
  "name": "text_v1 unicode nfc",
  "canonicalization": "text_v1",
  "input": {
    "encoding": "utf8",
    "value": "  Cafe\u0301\r\n"
  },
  "canonical_bytes_hex": "436166c3a9",
  "domain": "prompt:v1",
  "hash_algo": "hmac_sha256_64",
  "secret": {
    "utf8": "unicode-vector-secret"
  },
  "expected": {
    "digest64_hex": "fecf2353fc6ed653",
    "digest64_uint": 18360933049437181523
  }
}
