{
  "schema_version": 1,
  "name": "mcp session domain",
  "canonicalization": "text_v1",
  "input": {
    "encoding": "utf8",
    "value": "session-42"
  },
  "canonical_bytes_hex": "73657373696f6e2d3432",
  "domain": "mcp-session:v1",
  "hash_algo": "hmac_sha256_64",
  "secret": {
    "utf8": "c5-domain-vector-secret"
  },
  "expected": {
    "digest64_hex": "6815a788758a2790",
    "digest64_uint": 7500084958984808336
  }
}
